path,sentence
844424931029506-760-f.m4a,माधुरी से सर्वश्रेष्ठ अभिनेता का पुरस्कार पाकर रणबीर की आंखों में आंसू
844424932678030-725-f.m4a,फांसी की सजा पाए दो लोग थे मारिया के घर के प्रबंधक मो
844424932339460-436-f.m4a,पाकिस्तान के हिंदू क्रिकेटर दानिश कनेरिया को भारतीय नागरिकता देने की बात कही
844424932676688-725-f.m4a,आलोचना बैठक में अन्य लोगों के साथ उपस्थित थे ढाका महानगर मजलिश-ए-शूरा के सदस्य डॉ
844424932843761-725-f.m4a,बैठक में मुख्य अतिथि के रूप में बसुंधरा सीमेंट सेक्टर के मयमनसिंह सेल्स इंचार्ज मो
844424933095810-725-f.m4a,थाना और चौकी की सुरक्षा सुनिश्चित करने के लिए पर्याप्त प्रकाश व्यवस्था
844424932843818-725-f.m4a,आप एडेड यूनिवर्स और मैक्सिको में अनलॉक पा सकते हैं
844424932805246-725-f.m4a,सिलेट आलिया मदरसा के प्रवेश द्वार से पुलिस ने उसे गिरफ्तार किया
844424932675119-725-f.m4a,सीरिया ने दुश्मन के मिसाइल को नष्ट करने के लिए मिसाइल दागे
844424931323244-906-f.m4a,गोल्ड और सिल्वर रंग में यह फोन उपलब्ध
844424931185275-1116-f.m4a,नीली शर्ट में नमाज पढ़ते हुए युवक की तस्वीर
844424932332249-436-f.m4a,पुलिस अधिकारियों की देखरेख के लिए एक विशेष टीम गठित
844424931285091-906-f.m4a,प्राइवेट लैब में प्रैक्टिस के आरोप
844424931382756-1116-f.m4a,सीसीयू में काम कर रहे मेडिसिन विभाग के रेजिस्ट्रार
844424932803608-725-f.m4a,वह चार एक्सक्लूसिव गेम खेलने की बात कर सकते हैं
844424933095872-725-f.m4a,शांत रहने की अपील सभा में उपस्थित
844424932843806-725-f.m4a,विभाजनकारी नीतियों के खिलाफ विरोध
844424932332218-436-f.m4a,भारत बनाम दक्षिण अफ्रीका वनडे
844424931449818-906-f.m4a,अंतिम दिन पर नामांकन
844424932843818-725-f.m4a,एक्सेस का प्रावधान
844424931285056-906-f.m4a,"13,000 रुपये का अनुदान"
844424931382752-1116-f.m4a,पुलिस से अनुमति
844424932675198-725-f.m4a,शिक्षा अवकाश के बाद वापसी न करने पर राबी शिक्षक को नौकरी से हटाया गया
844424931034345-760-f.m4a,मोटीचूर चकनाचूर नामक फिल्म में नवाजुद्दीन सिद्दीकी के साथ स्क्रीन साझा कर रही हैं सनी लियोन
844424932803584-725-f.m4a,कोरोना से प्रभावित लोगों की संख्या लगभग 70 हजार है
844424932843828-725-f.m4a,महिलाओं को आत्मरक्षा के लिए हथियार उठाने की सलाह
844424931323320-906-f.m4a,सलमान के बाद भारत फिल्म में कैटरीना कैफ नजर आईं
844424933096451-725-f.m4a,"निर्वाचन नहीं हुआ, कारण असामान्य स्थिति थी"
844424932675128-725-f.m4a,कोरोना पॉजिटिव होकर भी चिकित्सा सेवाएं दे रहे मेडिकल अधिकारी
844424932805243-725-f.m4a,मुख्यमंत्री के आमंत्रण पर राज्यपाल के न आने पर नाराजगी
844424931029444-760-f.m4a,सोचने में त्रुटियां तर्कहीन विश्वास और नकारात्मक सोच
844424931034414-760-f.m4a,पावर बैंक पर बेहतरीन ऑफर दिवाली सेल में
844424933095852-725-f.m4a,इस सीट पर हाथपंखा प्रतीक का उम्मीदवार
844424932675196-725-f.m4a,आरबीआई यूनाइटेड फोरम की हड़ताल
844424931185296-1116-f.m4a,महामारी फैलाने की क्षमता नए वायरस में
844424932843744-725-f.m4a,मोबाइल चोरी का आरोप
844424932682882-725-f.m4a,भारत दो स्थान नीचे खिसका
844424931034423-760-f.m4a,मालदीव में चीनी रॉकेट का मलबा
844424932843797-725-f.m4a,भीड़ की हिंसा पर चर्चा
844424932355663-436-f.m4a,विशेष अतिथि के रूप में प्रोफेसर डॉ मौजूद
844424932843741-725-f.m4a,आईआरएस विकल्प पर कर सलाहकार से चर्चा
844424933095849-725-f.m4a,गवाह बनने के लिए मजबूर किया
844424931323237-906-f.m4a,म्यांमार प्रशासन रोहिंग्याओं को विदेशी नागरिक के रूप में मान्यता देने के लिए मजबूर कर रहा
844424932805233-725-f.m4a,सिस्टर निवेदिता के 150वें जन्मदिन के अवसर पर एक विशेष कार्यक्रम आयोजित
844424932682836-725-f.m4a,रायहान से मुलाकात करने के लिए मलेशिया के वकील आज ही
844424931285072-906-f.m4a,बांका शहर के मदरसे में पढ़ाई कर रहे बच्चों के शिक्षक
844424932843761-725-f.m4a,बैठक में मौजूद मुख्य अतिथि ने अपने विचार व्यक्त किए
844424931449794-906-f.m4a,एफआर टॉवर की नक्शा धोखाधड़ी मामले में चार्जशीट दाखिल
844424931034413-760-f.m4a,पिछले साल हांगकांग में साबुन संग्रह की परियोजना
844424932355687-436-f.m4a,कोरोना लक्षणों के कारण अस्पताल में भर्ती डॉ
844424932843770-725-f.m4a,ढाका विश्वविद्यालय के प्रोफेसर डॉ ने सवालों का जवाब दिया
844424932843806-725-f.m4a,वामपंथी दलों का विरोध प्रदर्शन
844424932843748-725-f.m4a,मालदा के वामपंथी नेताओं की घोषणा
844424932675168-725-f.m4a,जनसभा में राज्य सचिव बिजन धर ने विचार व्यक्त किए
844424931285056-906-f.m4a,प्रधानमंत्री राहत कोष में अनुदान
844424932803611-725-f.m4a,एकता फ्रंट की बैठक
844424931034380-760-f.m4a,भारत की संसद में नागरिकता विधेयक पास
844424933096451-725-f.m4a,निर्वाचन स्थगन की जानकारी
844424932675119-725-f.m4a,सीरिया के मिसाइल हमले
844424932805296-725-f.m4a,घटना के बाद अस्पताल में भर्ती
844424932332249-436-f.m4a,पुलिस अधिकारियों की निगरानी के लिए विशेष समिति गठित
844424932843797-725-f.m4a,भीड़ की हिंसा पर विधेयक
844424932804658-725-f.m4a,अभिनेत्री राइमा द्वारा साझा की गई तस्वीर
844424932682891-725-f.m4a,घरेलू हर्बल उपचार से बालों को हाइलाइट करना
844424932843828-725-f.m4a,महिलाओं को आत्मरक्षा के लिए सुझाव
844424931323284-906-f.m4a,आर्थिक संकट से आईडीबीआई बैंक को बचाने के प्रयास
844424931285121-906-f.m4a,सुप्रीम कोर्ट प्रशासन द्वारा पत्रकारों को जानकारी नहीं दी गई
844424932843741-725-f.m4a,आईआरएस विकल्प के बारे में जानकारी
844424932355663-436-f.m4a,चटगांव मेडिकल कॉलेज के प्राचार्य का संबोधन
844424932843818-725-f.m4a,अमेरिका और मैक्सिको में नई तकनीक
844424931185311-1116-f.m4a,मोबाइल निर्माण और इलेक्ट्रॉनिक उत्पादन पर जोर
844424933096414-725-f.m4a,सेलिब्रिटी मेहमान के रूप में आने की संभावना
844424932682815-725-f.m4a,कारण बताओ नोटिस के बाद असंतोषजनक जवाब
844424932803584-725-f.m4a,कोरोना महामारी से वैश्विक असर
844424932843748-725-f.m4a,वामपंथी दलों की नई रणनीति
844424931034414-760-f.m4a,पावर बैंक पर दिवाली ऑफर
844424932805246-725-f.m4a,सिलेट में मदरसा के गेट के पास गिरफ्तारी
844424932676624-725-f.m4a,प्रधानमंत्री का चमड़ा उद्योग पर संबोधन
844424931323325-906-f.m4a,देश के भीतर शिक्षण पर जोर
844424931285073-906-f.m4a,घटना के बाद एफआईआर दर्ज
844424932675128-725-f.m4a,कोरोना पॉजिटिव डॉक्टर द्वारा चिकित्सा सेवाएं
844424932805243-725-f.m4a,मुख्यमंत्री की गैरमौजूदगी पर नाराजगी
844424932843806-725-f.m4a,केंद्र की विभाजनकारी नीतियों के खिलाफ 17 वामपंथी दलों का आंदोलन
844424932332234-436-f.m4a,वे मिशिगन प्रांत के सागिनाव काउंटी में रहते हैं
844424932676629-725-f.m4a,बारिश के बीच बिजली गिरने की घटना
844424932843828-725-f.m4a,महिलाओं को आत्मरक्षा के लिए हथियार उठाने की सलाह
844424931449794-906-f.m4a,एफआर टॉवर की नक्शा धोखाधड़ी पर चार्जशीट
844424931034394-760-f.m4a,न्यूजीलैंड में आतंकी हमले के बाद जनाजे की खबर
844424932355618-436-f.m4a,मुंबई में 16 तारीख को संगीत कार्यक्रम आयोजित होगा
844424932805296-725-f.m4a,घटना के बाद अस्पताल में भर्ती किया गया
844424932355687-436-f.m4a,कोरोना वायरस के लक्षण के साथ डॉक्टर अस्पताल में भर्ती
844424932843770-725-f.m4a,ढाका विश्वविद्यालय के प्रोफेसर ने विषय पर विचार साझा किए
844424931449818-906-f.m4a,नामांकन प्रक्रिया के आखिरी दिन
844424932843818-725-f.m4a,नई तकनीक तक पहुंच की चर्चा
844424931185273-1116-f.m4a,मानसून में बीमारियों से बचाव के उपाय
844424932843797-725-f.m4a,भीड़ की हिंसा को रोकने के लिए विधेयक पर चर्चा
844424931323246-906-f.m4a,अंतर्राष्ट्रीय गिद्ध संरक्षण दिवस पर संबोधन
844424932675198-725-f.m4a,शिक्षा अवकाश से लौटने में विफल शिक्षक को सेवा से हटाया गया
844424931034423-760-f.m4a,भारत के करीब मालदीव में चीनी रॉकेट गिरा
844424932682882-725-f.m4a,पिछले साल की तुलना में भारत दो स्थान नीचे खिसका
844424933095889-725-f.m4a,अक्सर गंभीर बीमारी की चपेट में
844424932803611-725-f.m4a,फ्रंट के नेताओं की बैठक
844424932843741-725-f.m4a,आईआरएस विकल्प पर टैक्स पेशेवर से परामर्श
844424932675119-725-f.m4a,सीरिया ने मिसाइल हमले किए
844424931323244-906-f.m4a,गोल्ड और सिल्वर रंग में फोन उपलब्ध
844424931185311-1116-f.m4a,मोबाइल और इलेक्ट्रॉनिक उत्पादन पर जोर
844424932803584-725-f.m4a,कोरोना से वैश्विक मृत्यु
844424931034413-760-f.m4a,हांगकांग में साबुन संग्रह परियोजना
844424932843797-725-f.m4a,भीड़ की हिंसा को रोकने के लिए विधेयक
844424932676648-725-f.m4a,संबोधन में काव्यात्मक सौंदर्य
844424932843748-725-f.m4a,वामपंथी दलों की रणनीतिक बैठक
844424933096414-725-f.m4a,सेलिब्रिटी अतिथि आने की संभावना
844424932843761-725-f.m4a,मुख्य अतिथि का संबोधन
844424933095849-725-f.m4a,गवाह बनने पर बाध्यता
844424932805296-725-f.m4a,घटना के बाद अस्पताल में भर्ती
844424932843741-725-f.m4a,टैक्स पेशेवर से सलाह
844424932843770-725-f.m4a,ढाका विश्वविद्यालय के प्रोफेसर का वक्तव्य
844424933096414-725-f.m4a,सेलिब्रिटी अतिथि के रूप में उपस्थिति
844424931323284-906-f.m4a,आर्थिक संकट से बैंक को उबारा गया
844424932843828-725-f.m4a,महिलाओं को आत्मरक्षा के लिए सुझाव
844424931449818-906-f.m4a,नामांकन प्रक्रिया का अंतिम दिन
844424932805243-725-f.m4a,मुख्यमंत्री की गैरमौजूदगी पर चर्चा
844424931034423-760-f.m4a,भारत के पास मालदीव में गिरा चीनी रॉकेट
844424932843748-725-f.m4a,वाम दलों की नई योजना
844424932805233-725-f.m4a,सिस्टर निवेदिता के 150वें जन्मदिन पर विशेष कार्यक्रम
844424932803611-725-f.m4a,एकता फ्रंट की बैठक और चर्चा
844424931323237-906-f.m4a,म्यांमार प्रशासन रोहिंग्या को राष्ट्रीयता प्रमाण पत्र के लिए मजबूर कर रहा
844424932843806-725-f.m4a,केंद्र की नीतियों के खिलाफ वाम दलों का आंदोलन
844424931034413-760-f.m4a,हांगकांग में साबुन संग्रह परियोजना की उपलब्धियां
844424931185296-1116-f.m4a,नया वायरस महामारी फैलाने में सक्षम
844424932843828-725-f.m4a,महिलाओं को आत्मरक्षा में सक्षम बनाने की अपील
844424932843761-725-f.m4a,सीमेंट सेक्टर के मुख्य अतिथि का संबोधन
844424933095849-725-f.m4a,गवाह बनने के लिए मजबूरी
844424932843741-725-f.m4a,आईआरएस विकल्प के लिए पेशेवर सलाह
844424931323246-906-f.m4a,गिद्ध संरक्षण दिवस पर संबोधन
844424932843797-725-f.m4a,भीड़ की हिंसा रोकने के लिए चर्चा
844424931185273-1116-f.m4a,मानसून में बीमारियों से बचने के घरेलू उपाय
844424932676648-725-f.m4a,काव्य की सराहना में सुंदर शब्द
844424932355687-436-f.m4a,डॉक्टर ने कोरोना लक्षणों के कारण अस्पताल में भर्ती
844424932355618-436-f.m4a,मुंबई में 16 तारीख को संगीत कार्यक्रम
844424933095889-725-f.m4a,अक्सर गंभीर बीमारियों का सामना करना
844424932843770-725-f.m4a,ढाका विश्वविद्यालय के प्रोफेसर का वक्तव्य
844424932843818-725-f.m4a,आप एडेड यूनिवर्स और मैक्सिको तक पहुंच सकते हैं
844424932843828-725-f.m4a,महिलाओं को आत्मरक्षा के लिए प्रेरित किया गया
844424932803611-725-f.m4a,एकता फ्रंट के शीर्ष नेताओं की बैठक
844424932843806-725-f.m4a,विभाजनकारी नीतियों के खिलाफ वामपंथी आंदोलन
844424932843761-725-f.m4a,मुख्य अतिथि का भाषण
844424933095849-725-f.m4a,गवाह बनने की बाध्यता
844424932355687-436-f.m4a,कोरोना वायरस लक्षण वाले डॉक्टर अस्पताल में भर्ती
844424932355618-436-f.m4a,मुंबई में 16 तारीख को संगीत कार्यक्रम आयोजित
844424933095889-725-f.m4a,अक्सर गंभीर बीमारियों का शिकार
844424932843770-725-f.m4a,ढाका विश्वविद्यालय के प्रोफेसर द्वारा विचार साझा किए गए
844424932805296-725-f.m4a,घटना के बाद व्यक्ति को अस्पताल में भर्ती कराया गया
844424932675119-725-f.m4a,सीरिया ने मिसाइल का जवाब दिया
844424932843797-725-f.m4a,भीड़ की हिंसा पर विधेयक चर्चा
844424931034423-760-f.m4a,भारत के पास मालदीव में चीनी रॉकेट गिरा
844424931185311-1116-f.m4a,मोबाइल और इलेक्ट्रॉनिक उपकरणों पर जोर
844424932843741-725-f.m4a,आईआरएस विकल्प पर कर पेशेवर से सलाह
844424931185273-1116-f.m4a,मानसून में बीमारियों से बचाव के लिए सुझाव
844424933095889-725-f.m4a,गंभीर बीमारी से जूझते रहे
844424932803611-725-f.m4a,फ्रंट नेताओं की बैठक
844424932675196-725-f.m4a,आरबीआई अधिकारियों की हड़ताल
844424932843828-725-f.m4a,महिलाओं को आत्मरक्षा के लिए सुझाव दिए गए
844424932843806-725-f.m4a,वामपंथी दलों का आंदोलन विभाजनकारी नीतियों के खिलाफ
844424932803611-725-f.m4a,एकता फ्रंट के शीर्ष नेताओं की बैठक और निर्णय
844424931034423-760-f.m4a,भारत के पास मालदीव में चीनी रॉकेट गिरा
844424932843748-725-f.m4a,वामपंथी दलों की नई रणनीति
844424932805233-725-f.m4a,सिस्टर निवेदिता के 150वें जन्मदिन के अवसर पर आयोजन
844424932843761-725-f.m4a,मुख्य अतिथि का स्वागत भाषण
844424933095849-725-f.m4a,गवाह बनने की मजबूरी का विवरण
844424932803584-725-f.m4a,कोरोना महामारी के वैश्विक परिणाम
844424931034414-760-f.m4a,पावर बैंक पर दिवाली सेल के ऑफर
844424932805246-725-f.m4a,सिलेट मदरसा के गेट के पास से गिरफ्तारी
844424931185296-1116-f.m4a,नया वायरस महामारी फैलाने की क्षमता रखता है
844424931185273-1116-f.m4a,मानसून के दौरान स्वास्थ्य सुरक्षा पर सुझाव
844424933095889-725-f.m4a,गंभीर बीमारियों से जूझने की चुनौतियां
844424932355618-436-f.m4a,मुंबई में संगीत कार्यक्रम की तैयारी
844424932843770-725-f.m4a,ढाका विश्वविद्यालय के प्रोफेसर द्वारा विश्लेषण
844424932843828-725-f.m4a,महिलाओं के सशक्तिकरण पर बल
844424932675119-725-f.m4a,सीरिया ने दुश्मन के मिसाइल का जवाब दिया
844424932843797-725-f.m4a,भीड़ की हिंसा रोकने के लिए विधेयक पर चर्चा
844424931185311-1116-f.m4a,मोबाइल निर्माण और इलेक्ट्रॉनिक उत्पादन पर जोर
844424932843761-725-f.m4a,सीमेंट सेक्टर के अतिथि ने अपने विचार साझा किए
844424932843806-725-f.m4a,वामपंथी दलों का विभाजनकारी नीतियों के खिलाफ प्रदर्शन
844424933095849-725-f.m4a,गवाह बनने के लिए मजबूरी का वर्णन
844424932803584-725-f.m4a,कोरोना महामारी के वैश्विक प्रभाव
844424932675196-725-f.m4a,आरबीआई यूनाइटेड फोरम की हड़ताल की घोषणा
844424931034414-760-f.m4a,दिवाली ऑफर में पावर बैंक पर छूट
844424932805246-725-f.m4a,सिलेट मदरसा के मुख्य द्वार के पास गिरफ्तारी
844424931185273-1116-f.m4a,मानसून में बीमारियों से बचने के लिए आहार में सुधार
844424931185296-1116-f.m4a,नए वायरस की महामारी फैलाने की क्षमता पर शोध
844424932843770-725-f.m4a,ढाका विश्वविद्यालय के प्रोफेसर द्वारा समस्या पर प्रकाश डाला गया
844424931034423-760-f.m4a,मालदीव में गिरा चीनी रॉकेट
844424932843748-725-f.m4a,वामपंथी दलों की नई आंदोलनात्मक योजना
844424932805233-725-f.m4a,सिस्टर निवेदिता के 150वें जन्मदिन पर विशेष आयोजन
