path,sentence
844424931285116-906-f.m4a,तौकीर की परीक्षा से एक घंटे पहले छात्रों के बीच वह प्रश्नपत्र बांटा गया
844424932675128-725-f.m4a,कोरोना पॉजिटिव होने के बावजूद मरीजों का इलाज कर रहे शरियतपुर सिविल सर्जन ऑफिस के ड्यूटी मेडिकल ऑफिसर डॉ
844424931285091-906-f.m4a,अस्पताल न जाकर प्राइवेट पैथोलॉजी लैब में प्रैक्टिस करने का आरोप लगा एक डॉक्टर पर
844424933095886-725-f.m4a,अगर कुछ काम न आए तो सोने की मुद्रा बदलने से फायदा हो सकता है
844424931323317-906-f.m4a,लेकिन एंजेलीना जोली की तरह बनने के चक्कर में उन्होंने नीले रंग का लेंस पहना था
844424931285048-906-f.m4a,यह पहली बार है कि भारतीय क्रिकेट चयनकर्ता बनने के लिए विज्ञापन जारी किया गया है
844424931449852-906-f.m4a,हालांकि भविष्य में छोटे सुनामी भी आज के बड़े सुनामियों की भयावहता ला सकते हैं
844424932843785-725-f.m4a,आईपीएल में एमएस धोनी की शानदार कप्तानी के कुछ उदाहरण पेश किए गए
844424932804710-725-f.m4a,सरस्वती पूजा के अवसर पर राज्य सरकार के कर्मचारियों को लगभग एक सप्ताह की छुट्टी मिलने वाली है
844424932805243-725-f.m4a,आमंत्रण के बावजूद मुख्यमंत्री के राजभवन न आने पर राज्यपाल नाराज
844424931449867-906-f.m4a,पब्लिक लाइब्रेरी के शहीद दौलत मैदान में कॉक्स बाजार जिला अवामी लीग के अध्यक्ष एडवोकेट
844424931034414-760-f.m4a,आज इस बिग दिवाली सेल में शानदार पावर बैंक पर बेहतरीन ऑफर्स उपलब्ध हैं
844424932804685-725-f.m4a,इसमें मुख्य अतिथि के रूप में मौजूद थे बांग्ला न्यूज 24
844424931029441-760-f.m4a,एक मिलियन प्रयासों से नया सुपर कंप्यूटर दुनिया का सबसे तेज़ दिमागी नकल करने वाला उपकरण
844424930841727-70-f.m4a,प्रबंधन और विकास के लिए ईसी को आवंटित 1920 करोड़ रुपये
844424932676604-725-f.m4a,आज इस खबर की पुष्टि की कॉक्‍स बाजार मेडिकल कॉलेज के प्रिंसिपल प्रोफेसर डॉ
844424933095871-725-f.m4a,जानिए कल शारजाह में चेन्नई बनाम राजस्थान मैच का मोड़ पलटने वाले पल के बारे में
844424932843744-725-f.m4a,17 अगस्त को ढाका के हजारिबाग गणकटुली इलाके में मोबाइल चोरी का आरोप लगाकर मो
844424932678023-725-f.m4a,एक मोबाइल में पांच फोन नंबर ऑपरेट करने के लिए स्विच ऐप
844424933095810-725-f.m4a,रात में थाना और पुलिस चौकी की सुरक्षा सुनिश्चित करने के लिए पर्याप्त लाइट लगानी होगी
844424932804642-725-f.m4a,इस खबर को सुनते ही उनकी पुरानी प्रेमिका चार तोहाट गांव की निवासी मो
844424932355708-436-f.m4a,पूजा के खर्चे बचाकर घर-घर 500 रुपये और साबुन वितरित तामलुक में
844424932805233-725-f.m4a,सिस्टर निवेदिता के 150 साल पूरे होने के अवसर पर 3 अक्टूबर को महाजाति सदन में एक कार्यक्रम आयोजित किया गया
844424932682836-725-f.m4a,रायहान से मिलने के लिए मलेशिया के दो वकील आज ही
844424932675198-725-f.m4a,शिक्षा अवकाश के बाद लौटकर न आने पर राबी शिक्षक को नौकरी से हटाया गया
844424933096451-725-f.m4a,चुनाव न होने का कारण असामान्य स्थिति थी
844424932358428-436-f.m4a,और पढ़ें धोनी को बाहर रखकर दक्षिण अफ्रीका की टीम का चयन
844424931285057-906-f.m4a,विभिन्न स्वादों के सूप की रेसिपी शेफ असित कर्मकार सुजन ने दी
844424933096419-725-f.m4a,"साथ ही पूरा मामला फिलहाल बीजेपी की अनुशासन समिति देख रही है, अमित शाह ने कहा"
844424932332259-436-f.m4a,उन्हें नौकरी से हटा दिया गया और इसी तरह कहानी आगे बढ़ती है
844424932358453-436-f.m4a,फोरेंसिक टीम से हरी झंडी मिलने तक चटर्जी इंटरनेशनल बिल्डिंग बंद रहेगा
844424932438041-436-f.m4a,इस दौरान अन्य लोगों के बीच नेत्रकोना ग्रामीण विद्युत कार्यालय के अतिरिक्त महाप्रबंधक मो ने भाषण दिया
844424931382777-1116-f.m4a,अगर मुकदमे चलते रहते हैं तो इस महीने उस मामले में सफलता मिल सकती है
844424932355640-436-f.m4a,चीन के इस वुहान शहर से कोरोनावायरस पूरी दुनिया में फैल गया
844424931185273-1116-f.m4a,मानसून में बीमार पड़ने से पहले हर दिन खाने में कुछ ऐसी चीजें शामिल करें जो प्राकृतिक एंटीबायोटिक हों
844424933096498-725-f.m4a,इस आयोजन के लिए कवि जसिमुद्दीन ने 'बेदेर मेये' नाटक लिखा
844424931029428-760-f.m4a,लेकिन मेरे बगल में वह दोपहर का खाना खा लेता है
844424933096447-725-f.m4a,इसके जरिए लोगों को घर से बाहर आकर शांतिपूर्ण प्रदर्शन करने का आह्वान किया जा रहा है
844424932346129-436-f.m4a,भारतीय सेना ने पाकिस्तानी सेना की 4 चौकियों को पूरी तरह नष्ट कर दिया
844424932678006-725-f.m4a,वहां से पुराने मेडिकल ब्लॉक में स्थित चबी छात्र संघ के उपाध्यक्ष मो
844424932355652-436-f.m4a,गर्म पानी से नहाने के बावजूद चेहरे को ठंडे पानी से धोने की कोशिश करें
844424932437978-436-f.m4a,छुट्टियों के दिनों को यादगार बनाने के लिए अलग-अलग रेसिपी सीख सकते हैं
844424931185311-1116-f.m4a,भारत में मोबाइल फोन निर्माण को बढ़ावा दिया जाएगा। जोर दिया जाएगा इलेक्ट्रॉनिक उपकरण उत्पादन पर
844424933095820-725-f.m4a,क्योंकि इस साल पहली बार वह अपनी बेटी आराध्या के साथ रेड कार्पेट पर चलीं
844424932843741-725-f.m4a,इस आईआरएस विकल्प को समझाने के लिए अधिक दिशानिर्देशों के लिए टैक्स पेशेवर से सलाह लें
844424931449838-906-f.m4a,कोलकाता में 22 कैरेट सोने की कीमत में गिरावट आई है। प्रतीकात्मक चित्र
844424931034380-760-f.m4a,गैर-मुस्लिमों को अतिरिक्त लाभ देकर भारत की लोकसभा में नागरिकता बिल पास हुआ
844424932675196-725-f.m4a,"आरबीआई कर्मचारियों के यूनाइटेड फोरम की ओर से हड़ताल का आह्वान किया गया, फिर भी"
844424931034427-760-f.m4a,बैंक जमा पर उत्पाद शुल्क को लेकर संसद में हनीफ ने वित्त मंत्री मुहित पर निशाना साधा
844424931382767-1116-f.m4a,वार्ड से मरीज को बाहर निकालते समय भगदड़ में एक व्यक्ति की मौत हो गई
844424931323266-906-f.m4a,इस दौरान जरूरत पड़ने पर क्षेत्र का निरीक्षण करने की रुचि व्यक्त की मो ने
844424931185275-1116-f.m4a,नीली शर्ट पहने नमाज अदा करते हुए युवक को देखा गया
844424931382807-1116-f.m4a,15 जून तक सभी सार्वजनिक और निजी विश्वविद्यालयों की सभी गतिविधियां बंद रहेंगी
844424931323237-906-f.m4a,म्यांमार प्रशासन रोहिंग्याओं को नेशनल वेरिफिकेशन कार्ड लेने पर मजबूर कर रहा है
844424930757896-661-f.m4a,लंदन में रह रहे बीएनपी के कार्यकारी चेयरमैन तारिक रहमान की पत्नी डॉ
844424930757988-661-f.m4a,100 कंपनियों के सैनिक भेजकर कश्मीर में विकास का ढोल पीटा मोदी ने
844424930841716-70-f.m4a,सहायता की गुहार लगाते हुए ब्लड कैंसर से पीड़ित बियानीबाजार के अवामी लीग नेता अलीम की अपील
844424930757890-661-f.m4a,लेकिन समग्र वैश्विक और घरेलू परिस्थिति को देखते हुए दुख के साथ हमें इस साल आयोजन स्थगित करना पड़ा
844424930757898-661-f.m4a,यात्रा के कारण नकारात्मक भावनाओं से दूर रहने की बात करते हैं मिस्टर
844424930757909-661-f.m4a,बंदूकधारी गार्ड के बिना भोजन के ट्रक सड़क पर नहीं उतारे जा सकते
844424930841730-70-f.m4a,कैरी फिशर के रूप में प्रिंसेस लिया को शानदार मूवी स्टार वार्स में
844424930757977-661-f.m4a,गोपालपुर डिग्री कॉलेज में शिक्षक भर्ती सांसद समेत कमेटी के खिलाफ घूस व्यापार का आरोप
844424930841692-70-f.m4a,लेकिन सक्षम लोगों में से कई घर में समय खा-पीकर और मौज-मस्ती में बिता रहे हैं
844424930757899-661-f.m4a,सारदा समूह को एक चैनल बेचने के लिए मध्यस्थता करते हुए 9 करोड़ रुपये कमाए उन्होंने
844424930841694-70-f.m4a,डेढ़ साल के बच्चे को टब में बैठाकर सिर पर उठाए पुलिस अधिकारी ने तैरकर पार किया एक गहरा जल
844424930841749-70-f.m4a,बांग्लादेश के 9 पेज और 6 आईडी को फेसबुक ने बंद कर दिया
844424930757917-661-f.m4a,भीड़ संभालने में असमर्थ होकर सभी मार्केट बंद कर दिए गए
844424930841718-70-f.m4a,10 डॉक्टरों की टीम के मुख्य कार्यकारी अधिकारी के रूप में कार्य कर रहे हैं डॉ
844424930757914-661-f.m4a,टेक्नोक्रेट्स के साथ नई सरकार गठन का आह्वान किया लेबनान के राष्ट्रपति ने
844424930757903-661-f.m4a,लक्ष्मीपुर जिला राष्ट्रीय पार्टी के पूर्व अध्यक्ष प्रतिष्ठित उद्योगपति मो
844424930757941-661-f.m4a,मुग्दा अस्पताल में मरीज के परिजन और पत्रकार पर हमले की घटना में जांच समिति
844424930757962-661-f.m4a,शादी की सालगिरह पर पूर्व पति की तस्वीर शेयर कर खास संदेश श्रीलेखा का
844424930841699-70-f.m4a,गिरफ्तार छात्र लीग नेता तोफज्जल हुसैन पंच्छरी उपजिला उल्टाछरी यूनियन बंगाली गुच्छा ग्राम के अध्यक्ष मो
844424930841747-70-f.m4a,जिनेवा स्थित इस संगठन के एशिया-प्रशांत क्षेत्र में सदस्य बनने के लिए बांग्लादेश के अलावा
844424930757987-661-f.m4a,बाइजु बावरा फिल्म से रणवीर सिंह को हटाया निर्देशक ने
844424930757932-661-f.m4a,"बंगाल के दो पर्वतारोहियों को बचाने की कोशिश में जो समस्या आई, उसे निर्मल पुर्जा ने बताया"
844424930841745-70-f.m4a,नजरुल इस्लाम तालुकदार और जस्टिस के एम हाफिजुल आलम की हाईकोर्ट बेंच में एक रिपोर्ट
844424930841704-70-f.m4a,मृत 6 युवाओं के घर जाकर संवेदना जताई बियानीबाजार के जमीयत नेता
844424930757984-661-f.m4a,इस डिलीवरी में ऑपरेशन थिएटर में साथ थे नारायणगंज के डॉक्टर कमरुन्नाहर और उनके दो बेटे डॉ
844424930841748-70-f.m4a,चुनाव आयोग की निष्क्रियता और निष्पक्ष तरीके से वोट न कराने के विरोध में चुनाव आयुक्त सुनील
844424930841732-70-f.m4a,हाफिजुद्दीन खान और सचिव बदीउल आलम मजूमदार की ओर से डॉ
844424930757931-661-f.m4a,दुनिया के दूसरे सबसे बड़े कोरोना प्रभावित देश में गाड़ियों में ही 15 जोड़ों ने शादी कर ली
844424930757946-661-f.m4a,लक्ष्मी कर्मकार नाम की विकलांग किशोरी का घर चालसा रेलगेट के पास शिव मंदिर पाड़ा है
844424930757975-661-f.m4a,सांस लेने में समस्या के कारण अस्पताल में भर्ती हुईं सरोज खान
844424930757927-661-f.m4a,अमेरिका के बीच व्यापार गैर-अनुबंध और अनुबंध सीमित
844424930757947-661-f.m4a,स्वर्गीय आरएसपी के महासचिव क्षिति गोस्वामी का शव कोलकाता लाने की तैयारी
844424930757948-661-f.m4a,"दुनिया के जिन टीकों पर रिसर्च आगे बढ़ी है, उनमें ऑक्सफोर्ड यूनिवर्सिटी का टीका प्रमुख है"
844424930757944-661-f.m4a,इसी आदेश में टी बोर्ड में नए चेयरमैन के रूप में मेजर जनरल मो नियुक्त हुए
844424930757943-661-f.m4a,"आज 2,993 लोग अस्पताल से छुट्टी पाए"
844424930757908-661-f.m4a,इस साल पेड़ की जिम्मेदारी उनके पास थी। डाल टूटने पर उन्होंने राहुल को सजा दी
844424930757901-661-f.m4a,भारत के खिलाफ मैदान में उतरते ही दुर्लभ रिकॉर्ड बनाया रॉस टेलर ने
844424930757911-661-f.m4a,उस सेमिनार में मुख्य अतिथि के रूप में उपस्थित थे ग्रीस में नियुक्त बांग्लादेश के राजदूत मो
844424931309432-1116-f.m4a,सुशांत के रसोइए और दोस्त को साथ लेकर बांद्रा फ्लैट पहुंची सीबीआई
844424931185290-1116-f.m4a,इंस्टाग्राम पर एक वीडियो पोस्ट कर प्रशंसकों को शुभकामना दी मलाइका ने
844424931034409-760-f.m4a,4 लोगों को भोपाल से दिल्ली लाने के लिए पूरे एयरबस को किराए पर लिया गया
844424931309529-1116-f.m4a,रिक्शा में चढ़ने से पहले मेरे घर के लंबे समय से विश्वस्त कर्मचारी मो
844424931285055-906-f.m4a,विश्व इज्तेमा में सूरज और जन्नत नामक 2 बच्चे मिले
844424931029480-760-f.m4a,कोरोना वायरस की स्थिति और बिगड़ने पर सरकार ने बांग्लादेश के नागरिकों समेत अन्य देशों के लोगों को चीन से ए
844424931029431-760-f.m4a,कुल 59 लाख रुपये कोरोना से लड़ने के लिए दान दिए पूर्व भारतीय कप्तान ने
844424931285038-906-f.m4a,घोड़े के साथ फोटोशूट का विचार शादी के फोटोग्राफी तक ही सीमित नहीं है
844424931309525-1116-f.m4a,बंगाल के श्रमिकों की सुरक्षा के लिए एमओयू समझौता किया जाएगा विभिन्न राज्यों के साथ
844424931382794-1116-f.m4a,नैतिक एक विरोधाभास है कि कुछ भी अनैतिक या नैतिक हो सकता है
844424930757926-661-f.m4a,धर्म का अपमान करने के आरोप से आसिया बीबी को बरी किए जाने पर पांच हजार से अधिक प्रदर्शनकारियों के खिलाफ मामला दर्ज
844424931029429-760-f.m4a,इस दौरान विज्ञान और प्रौद्योगिकी मंत्रालय के वरिष्ठ सचिव इंजीनियर मो
844424931323292-906-f.m4a,मोहम्मद नसीम को संयोजक बनाकर इस समिति के सदस्य सचिव बने डॉ
844424931323301-906-f.m4a,सुनवाई के बाद अदालत ने अगले साल 17 जनवरी को सिविल सर्जन डॉ
844424931309484-1116-f.m4a,उसी समय अचानक पीछे से तेज गति से एक लोरी ने टक्कर मारी
844424931382737-1116-f.m4a,रोजा रखते समय वे कई बार समस्याओं का सामना करते हैं
844424931285073-906-f.m4a,"इस घटना में मामला दर्ज किया गया है, ऐसा बताया मो"
844424931449831-906-f.m4a,नए लोगों को टेरिटोरी ऑफिसर के पद पर नियुक्त कर रहा है ब्रिटिश अमेरिकन टोबैको
844424931382815-1116-f.m4a,सीरिया में मारे गए सैनिकों के शव प्राप्त करने के बाद उन्हें सम्मान दे रहे ट्रंप और पोंपिओ
844424931309506-1116-f.m4a,दाउदकांडी उपजिला कार्यकारी अधिकारी कमरुल इस्लाम खान की अध्यक्षता में उपस्थित थे आ
844424931382748-1116-f.m4a,विजय दिवस की पहली प्रहर में रात 12:01 बजे वाइस चांसलर प्रोफेसर डॉ
844424931323242-906-f.m4a,टीम गेम को हथियार बनाकर इस बार के रणजी में बंगाल अश्वमेध के घोड़े जैसा लग रहा है
844424931323272-906-f.m4a,ओहायर के सहयोग से डीएमपी मुख्यालय में 23 वॉटर प्योरिफायर और डिस्पेंसर लगाए गए
844424931285089-906-f.m4a,इस कानून को चुनौती देते हुए कई मुकदमे सुप्रीम कोर्ट में दर्ज किए गए
844424930841711-70-f.m4a,अरब सागर के किनारे नीरव मोदी के 100 करोड़ के बंगले को तोड़ना शुरू किया गया
844424931309487-1116-f.m4a,अहले सुन्नत के मालिकी मज़हब के संस्थापक मालिक इब्न अनस ने कहा
844424930757939-661-f.m4a,भारत में हर साल सबसे ज्यादा लोग कोबरा के डसने से मरते हैं
844424931185289-1116-f.m4a,यात्रा शुरू होने के एक दिन बाद ही वंदे भारत एक्सप्रेस ठप हो गई
844424930841706-70-f.m4a,करवा चौथ पर पत्नियों के लिए उपवास करते हैं ये बॉलीवुड सितारे भी
